id,journal_text,duration_min,sleep_hours,energy_level,stress_level,time_of_day,previous_day_mood,reflection_quality,emotional_state,intensity,cleaned_text,time_of_day_enc,reflection_quality_enc,previous_day_mood_enc,ambience_type_cafe,ambience_type_forest,ambience_type_mountain,ambience_type_ocean,ambience_type_rain,face_emotion_hint_calm_face,face_emotion_hint_happy_face,face_emotion_hint_neutral_face,face_emotion_hint_none,face_emotion_hint_tense_face,face_emotion_hint_tired_face,face_emotion_hint_unknown
587,Honestly got distracted again. ...,20,5.0,5,4,morning,overwhelmed,conflicted,calm,5,honestly got distracted again,1,1,5,False,False,False,True,False,False,False,False,False,True,False,False
588,"honestly okay session. tehn it shifted some peace, some noise in head.",8,7.0,4,1,evening,restless,conflicted,focused,2,honestly okay session tehn it shifted some peace some noise in head,3,1,4,False,False,False,False,True,True,False,False,False,False,False,False
589,"During the session felt good for a moment. Later it changed felt lighter, not fully though.",30,5.0,2,1,morning,calm,vague,mixed,5,during the session felt good for a moment later it changed felt lighter not fully though,1,0,0,False,True,False,False,False,True,False,False,False,False,False,False
590,not sure what changed,18,6.0,5,5,evening,restless,vague,mixed,1,not sure what changed,3,0,4,False,False,True,False,False,False,False,False,False,False,True,False
591,I guess could focus for a while.,18,7.0,2,1,afternoon,overwhelmed,clear,restless,4,i guess could focus for a while,2,2,5,False,False,True,False,False,True,False,False,False,False,False,False
592,By the end breathing slowed down.,30,5.0,3,2,afternoon,overwhelmed,clear,calm,3,by the end breathing slowed down,2,2,5,False,True,False,False,False,False,False,False,False,False,True,False
593,felt better after a bit,8,5.0,3,4,afternoon,neutral,clear,overwhelmed,2,felt better after a bit,2,2,2,False,False,True,False,False,False,False,False,False,False,True,False
594,At first kept thinking about work. Then it shifted got distracted again.,15,5.0,1,4,afternoon,mixed,clear,neutral,4,at first kept thinking about work then it shifted got distracted again,2,2,3,False,False,True,False,False,True,False,False,False,False,False,False
595,I guess felt better after a bit.,10,6.0,4,1,afternoon,focused,conflicted,neutral,2,i guess felt better after a bit,2,1,1,False,False,False,False,True,False,True,False,False,False,False,False
596,mind was all over the place,12,6.0,2,2,evening,focused,clear,mixed,1,mind was all over the place,3,2,1,False,False,False,True,False,False,False,False,True,False,False,False
597,Honestly felt good for a moment.,15,7.0,1,1,afternoon,focused,conflicted,mixed,3,honestly felt good for a moment,2,1,1,True,False,False,False,False,False,False,True,False,False,False,False
598,For some reason still anxious a bit.,20,8.0,1,1,morning,restless,clear,calm,4,for some reason still anxious a bit,1,2,4,False,False,False,True,False,False,False,False,False,True,False,False
599,back to normal after ...,5,8.0,2,2,morning,mixed,conflicted,overwhelmed,2,back to normal after,1,1,3,True,False,False,False,False,True,False,False,False,False,False,False
600,during the session helped me plan my day. later it changed felt good for a moment.,30,4.0,2,1,evening,calm,clear,restless,1,during the session helped me plan my day later it changed felt good for a moment,3,2,0,False,True,False,False,False,False,True,False,False,False,False,False
601,at first could focus for a while.,30,5.0,1,4,morning,overwhelmed,clear,overwhelmed,3,at first could focus for a while,1,2,5,False,False,False,True,False,False,True,False,False,False,False,False
602,breathing slowed down,18,6.0,4,5,afternoon,overwhelmed,conflicted,restless,1,breathing slowed down,2,1,5,False,False,True,False,False,False,False,False,True,False,False,False
603,Honestly breathing slowed down. ...,5,5.0,4,4,morning,calm,conflicted,restless,5,honestly breathing slowed down,1,1,0,False,True,False,False,False,False,False,False,True,False,False,False
604,back to normal after ...,8,4.0,5,1,evening,restless,conflicted,restless,2,back to normal after,3,1,4,True,False,False,False,False,False,False,False,False,True,False,False
605,for some reason kept thinking about work.,15,7.0,1,5,evening,focused,conflicted,calm,1,for some reason kept thinking about work,3,1,1,False,True,False,False,False,False,False,False,False,False,True,False
606,it was fine,25,5.0,5,3,night,restless,clear,mixed,2,it was fine,4,2,4,True,False,False,False,False,False,True,False,False,False,False,False
607,back to normal after ...,15,6.0,2,2,afternoon,restless,clear,restless,1,back to normal after,2,2,4,False,False,False,True,False,False,False,False,False,True,False,False
608,got distracted again,10,7.0,3,1,night,restless,conflicted,focused,3,got distracted again,4,1,4,True,False,False,False,False,False,False,False,True,False,False,False
609,by the end felt good for a moment.,20,7.0,3,2,morning,overwhelmed,vague,focused,5,by the end felt good for a moment,1,0,5,False,False,False,True,False,False,False,False,False,False,False,True
610,Honestly still anxious a bit. After some time kinda calm now.,18,6.0,3,3,morning,mixed,vague,focused,4,honestly still anxious a bit after some time kinda calm now,1,0,3,False,False,True,False,False,False,False,False,False,False,True,False
611,that helped a little,18,5.0,1,3,afternoon,overwhelmed,clear,overwhelmed,1,that helped a little,2,2,5,False,False,False,False,True,False,False,True,False,False,False,False
612,I guess that helped a little.,18,7.0,5,5,morning,neutral,conflicted,calm,3,i guess that helped a little,1,1,2,False,False,False,False,True,False,False,False,False,False,True,False
613,for some reason could focus for a while.,20,8.0,5,2,night,neutral,conflicted,overwhelmed,3,for some reason could focus for a while,4,1,2,False,True,False,False,False,False,False,False,False,False,True,False
614,"Honestly felt lighter, not fully though. ...",18,6.0,5,2,night,mixed,clear,mixed,5,honestly felt lighter not fully though,4,2,3,True,False,False,False,False,False,False,False,True,False,False,False
615,okay session,20,4.0,3,5,morning,calm,vague,restless,5,okay session,1,0,0,True,False,False,False,False,True,False,False,False,False,False,False
616,honestly helped me plan my day.,10,8.0,5,3,afternoon,overwhelmed,conflicted,calm,1,honestly helped me plan my day,2,1,5,False,False,False,False,True,False,True,False,False,False,False,False
617,for some reason kinda calm now.,5,7.0,4,5,evening,focused,conflicted,focused,2,for some reason kinda calm now,3,1,1,False,False,False,True,False,False,False,False,True,False,False,False
618,kept thinking about work,12,4.0,3,2,night,neutral,clear,restless,4,kept thinking about work,4,2,2,False,False,False,False,True,True,False,False,False,False,False,False
619,could focus for a while,8,6.0,1,4,afternoon,mixed,vague,calm,5,could focus for a while,2,0,3,True,False,False,False,False,False,False,False,False,False,True,False
620,I guess felt better after a bit.,18,6.0,2,5,night,restless,vague,focused,1,i guess felt better after a bit,4,0,4,False,False,True,False,False,True,False,False,False,False,False,False
621,"honestly back to normal after. then it shifted some peace, some noise in head.",10,4.0,3,1,morning,focused,vague,calm,5,honestly back to normal after then it shifted some peace some noise in head,1,0,1,False,False,True,False,False,False,False,False,True,False,False,False
622,"At first felt lighter, not fully though.",25,8.0,2,3,afternoon,mixed,vague,focused,5,at first felt lighter not fully though,2,0,3,True,False,False,False,False,False,False,True,False,False,False,False
623,During teh session could focus for a while. Later it changed still anxious a bit.,5,8.0,1,5,afternoon,restless,clear,overwhelmed,4,during teh session could focus for a while later it changed still anxious a bit,2,2,4,True,False,False,False,False,False,False,False,False,False,True,False
624,at first breathing slowed down. ...,12,6.0,5,3,evening,focused,conflicted,mixed,4,at first breathing slowed down,3,1,1,False,True,False,False,False,True,False,False,False,False,False,False
625,I guess not sure what changed.,20,6.0,4,1,evening,mixed,clear,restless,2,i guess not sure what changed,3,2,3,False,False,False,False,True,False,False,True,False,False,False,False
626,still anxious a bit ...,20,4.0,5,2,morning,neutral,vague,restless,2,still anxious a bit,1,0,2,False,True,False,False,False,False,False,True,False,False,False,False
627,For some reason kept thinking about work.,5,4.0,1,3,afternoon,mixed,clear,neutral,1,for some reason kept thinking about work,2,2,3,False,False,False,True,False,False,True,False,False,False,False,False
628,By the end mind was all over the place.,25,8.0,2,3,evening,mixed,conflicted,restless,4,by the end mind was all over the place,3,1,3,False,False,False,True,False,False,False,False,False,False,True,False
629,At first felt heavy.,15,7.0,2,1,afternoon,neutral,clear,neutral,2,at first felt heavy,2,2,2,False,True,False,False,False,False,True,False,False,False,False,False
630,still a bit off tbh ...,12,6.0,2,2,afternoon,calm,conflicted,neutral,4,still a bit off tbh,2,1,0,False,False,False,False,True,False,False,False,False,False,True,False
631,At first not sure what changed.,10,4.0,5,4,night,overwhelmed,clear,focused,1,at first not sure what changed,4,2,5,False,False,False,False,True,False,False,False,True,False,False,False
632,honestly not much change,18,5.0,1,3,night,overwhelmed,conflicted,mixed,3,honestly not much change,4,1,5,False,False,False,False,True,False,False,False,False,False,False,True
633,Honestly felt better after a bit.,25,6.0,5,3,afternoon,neutral,vague,restless,1,honestly felt better after a bit,2,0,2,False,False,False,True,False,False,False,False,False,False,True,False
634,For some reason kept thinking about work.,30,4.0,4,2,afternoon,calm,conflicted,restless,3,for some reason kept thinking about work,2,1,0,False,True,False,False,False,False,False,False,True,False,False,False
635,At first got distracted again.,20,6.0,3,2,morning,focused,vague,mixed,4,at first got distracted again,1,0,1,True,False,False,False,False,False,False,False,False,False,False,True
636,during the session helped me plan my day. after some time mind was all over the place.,18,7.0,1,1,morning,calm,conflicted,overwhelmed,5,during the session helped me plan my day after some time mind was all over the place,1,1,0,False,False,False,True,False,False,False,True,False,False,False,False
637,still a bit off tbh,5,7.0,1,2,night,neutral,conflicted,overwhelmed,3,still a bit off tbh,4,1,2,False,False,False,True,False,False,False,False,False,True,False,False
638,For some reason breathing slowed down.,18,5.0,4,5,evening,neutral,conflicted,neutral,4,for some reason breathing slowed down,3,1,2,False,False,False,True,False,True,False,False,False,False,False,False
639,At first that helped a little.,18,5.0,2,4,night,restless,conflicted,restless,2,at first that helped a little,4,1,4,False,False,True,False,False,False,True,False,False,False,False,False
640,honestly could focus for a while.,15,4.0,2,3,night,focused,conflicted,neutral,4,honestly could focus for a while,4,1,1,False,False,True,False,False,False,False,False,True,False,False,False
641,Honestly felt good for a moment.,8,4.0,4,2,morning,overwhelmed,conflicted,focused,4,honestly felt good for a moment,1,1,5,True,False,False,False,False,False,False,False,True,False,False,False
642,at first helped me plan my day. later it changed mind was all over the place. ...,25,5.0,1,3,evening,calm,conflicted,neutral,2,at first helped me plan my day later it changed mind was all over the place,3,1,0,False,False,False,True,False,False,False,True,False,False,False,False
643,at first helped me plan my day.,30,6.0,3,1,evening,mixed,vague,overwhelmed,1,at first helped me plan my day,3,0,3,False,True,False,False,False,False,False,False,False,True,False,False
644,back to normal after ...,25,5.0,3,3,morning,calm,vague,neutral,1,back to normal after,1,0,0,False,False,False,False,True,False,True,False,False,False,False,False
645,back to normal after,25,5.0,5,3,morning,calm,vague,calm,2,back to normal after,1,0,0,False,False,False,False,True,False,False,False,False,True,False,False
646,honestly still a bit off tbh.,20,8.0,4,4,afternoon,neutral,conflicted,overwhelmed,1,honestly still a bit off tbh,2,1,2,True,False,False,False,False,False,False,False,False,False,True,False
647,By teh end not sure what changed.,18,6.0,4,3,morning,restless,conflicted,restless,4,by teh end not sure what changed,1,1,4,False,False,False,False,True,False,False,False,False,True,False,False
648,it was fine,18,5.0,3,4,afternoon,mixed,clear,restless,5,it was fine,2,2,3,False,False,False,True,False,False,False,False,False,True,False,False
649,For some reason kinda calm now.,30,5.0,1,3,afternoon,restless,conflicted,calm,4,for some reason kinda calm now,2,1,4,False,False,False,True,False,False,False,False,False,True,False,False
650,By the end honestly not much change.,25,6.0,2,2,night,overwhelmed,vague,restless,5,by the end honestly not much change,4,0,5,False,True,False,False,False,False,False,False,True,False,False,False
651,At first that helped a little.,10,6.0,1,2,evening,neutral,vague,restless,4,at first that helped a little,3,0,2,False,False,False,True,False,False,False,False,False,False,False,True
652,Honestly honestly not much change.,12,8.0,1,2,morning,overwhelmed,vague,restless,2,honestly honestly not much change,1,0,5,False,False,True,False,False,True,False,False,False,False,False,False
653,During the session kinda calm now. Then it shifted could focus for a while.,15,4.0,1,5,morning,mixed,vague,neutral,1,during the session kinda calm now then it shifted could focus for a while,1,0,3,False,False,False,False,True,False,False,True,False,False,False,False
654,Honestly honestly not much change.,20,4.0,4,1,evening,overwhelmed,clear,focused,1,honestly honestly not much change,3,2,5,False,False,False,False,True,False,False,False,False,False,True,False
655,By the end still a bit off tbh.,18,5.0,1,1,evening,overwhelmed,vague,restless,5,by the end still a bit off tbh,3,0,5,True,False,False,False,False,True,False,False,False,False,False,False
656,at first still anxious a bit. after some time breathing slowed down.,25,7.0,1,3,evening,restless,conflicted,mixed,5,at first still anxious a bit after some time breathing slowed down,3,1,4,True,False,False,False,False,False,False,False,True,False,False,False
657,back to normal after,10,6.0,2,2,morning,calm,conflicted,restless,5,back to normal after,1,1,0,False,False,False,True,False,True,False,False,False,False,False,False
658,By teh end still anxious a bit.,25,5.0,5,1,afternoon,mixed,vague,focused,4,by teh end still anxious a bit,2,0,3,True,False,False,False,False,False,False,False,False,False,True,False
659,Honestly kinda calm now.,12,7.0,3,1,morning,restless,clear,overwhelmed,3,honestly kinda calm now,1,2,4,False,False,False,True,False,False,False,False,False,False,True,False
660,got distracted again,15,6.0,4,2,afternoon,restless,vague,mixed,1,got distracted again,2,0,4,False,False,True,False,False,False,False,False,False,False,True,False
661,"At first felt lighter, not fully though.",18,5.0,5,1,morning,overwhelmed,clear,restless,4,at first felt lighter not fully though,1,2,5,False,True,False,False,False,False,False,False,True,False,False,False
662,Honestly not sure what changed.,20,5.0,5,3,morning,overwhelmed,vague,focused,4,honestly not sure what changed,1,0,5,False,False,False,False,True,False,False,False,True,False,False,False
663,at first felt better after a bit.,8,7.0,1,1,morning,overwhelmed,clear,restless,5,at first felt better after a bit,1,2,5,False,True,False,False,False,True,False,False,False,False,False,False
664,back to normal after,18,4.0,5,3,afternoon,focused,conflicted,overwhelmed,1,back to normal after,2,1,1,False,True,False,False,False,True,False,False,False,False,False,False
665,kept thinking about work,25,7.0,5,3,evening,neutral,vague,restless,4,kept thinking about work,3,0,2,False,False,False,True,False,True,False,False,False,False,False,False
666,By the end back to normal after.,30,7.0,4,2,evening,mixed,conflicted,mixed,4,by the end back to normal after,3,1,3,False,False,False,False,True,False,False,True,False,False,False,False
667,Honestly still anxious a bit. ...,5,8.0,3,4,night,mixed,conflicted,focused,4,honestly still anxious a bit,4,1,3,False,False,False,True,False,False,True,False,False,False,False,False
668,I guess could focus for a while.,18,6.0,1,4,morning,mixed,conflicted,neutral,2,i guess could focus for a while,1,1,3,False,False,False,False,True,False,False,False,True,False,False,False
669,honestly not much change,30,8.0,2,2,afternoon,neutral,clear,neutral,3,honestly not much change,2,2,2,False,False,False,False,True,False,False,False,False,True,False,False
670,it was fine,8,4.0,3,4,night,focused,conflicted,focused,3,it was fine,4,1,1,False,False,False,True,False,False,False,False,False,False,True,False
671,For some reason felt good for a moment.,30,6.0,4,1,afternoon,calm,conflicted,overwhelmed,2,for some reason felt good for a moment,2,1,0,False,True,False,False,False,False,False,True,False,False,False,False
672,At first still anxious a bit.,10,4.0,5,2,evening,mixed,conflicted,restless,3,at first still anxious a bit,3,1,3,False,False,True,False,False,False,True,False,False,False,False,False
673,it was fine,5,5.0,2,4,night,overwhelmed,vague,restless,1,it was fine,4,0,5,False,False,False,False,True,False,False,False,False,True,False,False
674,honestly still anxious a bit. later it changed got distracted again.,8,8.0,2,5,morning,overwhelmed,vague,mixed,4,honestly still anxious a bit later it changed got distracted again,1,0,5,False,False,False,False,True,False,False,False,False,True,False,False
675,Honestly kinda calm now.,20,7.0,4,4,night,focused,conflicted,neutral,1,honestly kinda calm now,4,1,1,False,False,True,False,False,False,False,False,False,False,False,True
676,i guess back to normal after.,5,7.0,4,1,morning,overwhelmed,clear,mixed,2,i guess back to normal after,1,2,5,False,False,False,True,False,False,True,False,False,False,False,False
677,okay session ...,10,7.0,5,2,evening,restless,clear,neutral,5,okay session,3,2,4,False,False,True,False,False,False,False,False,True,False,False,False
678,Honestly felt good for a moment. Later it changed mind was all over the place.,15,8.0,4,5,afternoon,overwhelmed,vague,calm,5,honestly felt good for a moment later it changed mind was all over the place,2,0,5,False,False,False,True,False,False,False,False,False,True,False,False
679,still a bit off tbh,25,7.0,5,2,morning,mixed,vague,restless,1,still a bit off tbh,1,0,3,False,False,False,False,True,False,False,True,False,False,False,False
680,for some reason breathing slowed down.,25,5.0,2,5,afternoon,focused,clear,neutral,2,for some reason breathing slowed down,2,2,1,False,True,False,False,False,False,False,False,True,False,False,False
681,mind was all over the place ...,15,8.0,2,4,afternoon,neutral,clear,overwhelmed,2,mind was all over the place,2,2,2,False,True,False,False,False,False,False,False,True,False,False,False
682,i guess kinda calm now. ...,10,5.0,3,4,morning,focused,vague,mixed,3,i guess kinda calm now,1,0,1,False,False,False,True,False,True,False,False,False,False,False,False
683,For some reason not sure what changed.,20,5.0,2,2,afternoon,mixed,vague,focused,2,for some reason not sure what changed,2,0,3,True,False,False,False,False,False,False,False,False,False,False,True
684,at first it was fine.,30,7.0,1,1,morning,restless,vague,mixed,3,at first it was fine,1,0,4,True,False,False,False,False,False,False,True,False,False,False,False
685,At first okay session. Later it changed kept thinking about work.,15,4.0,2,2,morning,neutral,conflicted,calm,1,at first okay session later it changed kept thinking about work,1,1,2,False,False,True,False,False,False,False,True,False,False,False,False
686,not sure what changed,15,7.0,4,2,morning,mixed,conflicted,calm,4,not sure what changed,1,1,3,False,False,False,False,True,True,False,False,False,False,False,False
687,"felt lighter, not fully though ...",18,8.0,5,1,morning,restless,conflicted,calm,2,felt lighter not fully though,1,1,4,True,False,False,False,False,False,False,False,False,False,True,False
688,honestly breathing slowed down.,10,6.0,2,3,night,restless,conflicted,restless,5,honestly breathing slowed down,4,1,4,False,False,False,True,False,True,False,False,False,False,False,False
689,At first helped me plan my day.,30,5.0,3,4,afternoon,calm,clear,calm,1,at first helped me plan my day,2,2,0,False,False,False,False,True,False,False,True,False,False,False,False
690,For some reason okay session.,15,5.0,3,1,morning,calm,conflicted,calm,5,for some reason okay session,1,1,0,False,False,True,False,False,True,False,False,False,False,False,False
691,felt good for a moment,10,8.0,2,4,morning,restless,vague,focused,4,felt good for a moment,1,0,4,False,False,False,True,False,False,False,False,False,False,True,False
692,At first felt good for a moment.,8,5.0,2,2,morning,overwhelmed,clear,calm,4,at first felt good for a moment,1,2,5,False,True,False,False,False,False,False,False,True,False,False,False
693,During the session mind was all over the place. Then it shifted still a bit off tbh. ...,25,6.0,5,2,afternoon,restless,conflicted,neutral,3,during the session mind was all over the place then it shifted still a bit off tbh,2,1,4,False,False,False,False,True,False,False,False,True,False,False,False
694,During the session helped me plan my day. Then it shifted felt heavy.,8,8.0,3,5,evening,focused,clear,calm,2,during the session helped me plan my day then it shifted felt heavy,3,2,1,False,False,True,False,False,True,False,False,False,False,False,False
695,I guess helped me plan my day.,12,7.0,4,3,evening,mixed,conflicted,neutral,4,i guess helped me plan my day,3,1,3,False,False,True,False,False,True,False,False,False,False,False,False
696,For some reason felt better after a bit.,8,7.0,5,3,evening,overwhelmed,vague,restless,5,for some reason felt better after a bit,3,0,5,False,True,False,False,False,False,False,True,False,False,False,False
697,"By the end felt lighter, not fully though.",10,5.0,1,2,night,restless,vague,calm,2,by the end felt lighter not fully though,4,0,4,False,False,False,False,True,False,False,False,False,False,False,True
698,still anxious a bit,20,6.0,5,5,morning,calm,clear,restless,1,still anxious a bit,1,2,0,False,False,False,True,False,False,False,True,False,False,False,False
699,By the end got distracted again.,20,8.0,4,2,morning,neutral,conflicted,focused,3,by the end got distracted again,1,1,2,False,False,True,False,False,False,False,False,True,False,False,False
700,"Honestly that helped a little. After some time some peace, some noise in head. ...",8,7.0,4,3,night,overwhelmed,vague,overwhelmed,5,honestly that helped a little after some time some peace some noise in head,4,0,5,False,False,False,False,True,False,False,False,False,False,False,True
701,Honestly breathing slowed down.,20,6.0,2,2,afternoon,mixed,conflicted,focused,3,honestly breathing slowed down,2,1,3,True,False,False,False,False,True,False,False,False,False,False,False
702,back to normal after,15,4.0,4,4,evening,focused,conflicted,mixed,4,back to normal after,3,1,1,False,False,False,True,False,False,False,False,True,False,False,False
703,At first okay session.,18,8.0,2,3,afternoon,restless,vague,calm,4,at first okay session,2,0,4,True,False,False,False,False,False,False,False,False,False,True,False
704,"i guess some peace, some noise in head.",25,7.0,4,3,night,mixed,clear,focused,3,i guess some peace some noise in head,4,2,3,True,False,False,False,False,False,True,False,False,False,False,False
705,back to normal after,15,4.0,3,4,morning,restless,vague,calm,1,back to normal after,1,0,4,False,False,False,True,False,False,True,False,False,False,False,False
706,During the session that helped a little. Later it changed still anxious a bit.,8,4.0,5,1,evening,focused,conflicted,calm,2,during the session that helped a little later it changed still anxious a bit,3,1,1,True,False,False,False,False,False,False,False,False,False,True,False
707,I guess breathing slowed down.,10,5.0,2,5,afternoon,restless,conflicted,mixed,1,i guess breathing slowed down,2,1,4,False,True,False,False,False,False,False,False,False,True,False,False
708,For some reason could focus for a while.,30,6.0,2,2,morning,restless,clear,overwhelmed,4,for some reason could focus for a while,1,2,4,False,True,False,False,False,False,False,True,False,False,False,False
709,I guess still anxious a bit.,8,8.0,5,3,evening,mixed,conflicted,restless,1,i guess still anxious a bit,3,1,3,False,False,False,True,False,False,False,False,False,True,False,False
710,Honestly kinda calm now. ...,30,5.0,4,3,morning,calm,conflicted,restless,4,honestly kinda calm now,1,1,0,False,True,False,False,False,False,True,False,False,False,False,False
711,breathing slowed down,5,8.0,2,3,afternoon,focused,clear,calm,5,breathing slowed down,2,2,1,False,False,True,False,False,False,True,False,False,False,False,False
712,By the end mind was all over the place.,18,8.0,4,2,evening,mixed,vague,restless,1,by the end mind was all over the place,3,0,3,False,False,True,False,False,True,False,False,False,False,False,False
713,I guess it was fine.,12,5.0,3,5,morning,mixed,conflicted,mixed,1,i guess it was fine,1,1,3,False,False,True,False,False,False,False,False,False,True,False,False
714,at first kept thinking about work.,12,6.0,1,5,night,calm,conflicted,overwhelmed,5,at first kept thinking about work,4,1,0,False,False,False,True,False,False,False,False,False,False,False,True
715,At first helped me plan my day.,25,4.0,2,3,morning,restless,clear,restless,2,at first helped me plan my day,1,2,4,True,False,False,False,False,False,False,False,False,False,False,True
