id,journal_text,duration_min,sleep_hours,energy_level,stress_level,time_of_day,previous_day_mood,reflection_quality,emotional_state,intensity,cleaned_text,time_of_day_enc,reflection_quality_enc,previous_day_mood_enc,ambience_type_cafe,ambience_type_forest,ambience_type_mountain,ambience_type_ocean,ambience_type_rain,face_emotion_hint_calm_face,face_emotion_hint_happy_face,face_emotion_hint_neutral_face,face_emotion_hint_none,face_emotion_hint_tense_face,face_emotion_hint_tired_face,face_emotion_hint_unknown
725,not gonna lie i felt not very different. my breathing slowed for a moment.,10,5.0,2,1,afternoon,restless,vague,neutral,4,not gonna lie i felt not very different my breathing slowed for a moment,2,0,4,False,True,False,False,False,False,False,False,False,True,False,False
726,"for a while i was surprisingly okay, but this was better than yesterday.",30,4.0,5,3,afternoon,neutral,vague,calm,5,for a while i was surprisingly okay but this was better than yesterday,2,0,2,False,False,True,False,False,False,False,False,True,False,False,False
727,kind of felt mentally flooded. then my mind wandered again.,25,3.5,5,5,evening,focused,conflicted,overwhelmed,3,kind of felt mentally flooded then my mind wandered again,3,1,1,False,False,False,True,False,False,False,False,False,True,False,False
728,somehow i felt more organized mentally. cafe ambience weirdly helped. not sure why but it shifted.,20,7.0,5,2,evening,overwhelmed,vague,focused,3,somehow i felt more organized mentally cafe ambience weirdly helped not sure why but it shifted,3,0,5,False,True,False,False,False,False,False,True,False,False,False,False
729,kind of felt clearer than earlier. i had to restart once. that part surprised me.,10,6.0,3,5,afternoon,calm,vague,focused,1,kind of felt clearer than earlier i had to restart once that part surprised me,2,0,0,True,False,False,False,False,False,False,False,False,False,False,True
730,"ended up heavy in the chest, but i couldn't tell if it was helping at first.",18,7.0,5,4,evening,mixed,clear,overwhelmed,3,ended up heavy in the chest but i couldnt tell if it was helping at first,3,2,3,False,False,False,False,True,False,False,False,False,True,False,False
731,lowkey felt pretty grounded. i stayed with it anyway.,15,5.0,2,4,night,restless,clear,calm,5,lowkey felt pretty grounded i stayed with it anyway,4,2,4,False,False,True,False,False,False,True,False,False,False,False,False
732,"i noticed i was drained and behind, but this was better than yesterday.",30,5.0,4,1,night,overwhelmed,conflicted,overwhelmed,5,i noticed i was drained and behind but this was better than yesterday,4,1,5,False,False,False,False,True,False,False,True,False,False,False,False
733,honestly i felt able to prioritize. cafe ambience weirdly helped.,10,3.5,5,4,afternoon,overwhelmed,vague,focused,3,honestly i felt able to prioritize cafe ambience weirdly helped,2,0,5,False,False,False,True,False,True,False,False,False,False,False,False
734,started off kind of jumpy. my breathing slowed for a moment.,10,8.5,3,2,night,restless,clear,restless,2,started off kind of jumpy my breathing slowed for a moment,4,2,4,False,False,False,False,True,False,False,False,True,False,False,False
735,a little lighter,7,5.0,3,4,afternoon,mixed,conflicted,restless,4,a little lighter,2,1,3,False,False,False,True,False,False,False,True,False,False,False,False
736,honestly i felt lighter than before. i couldn't tell if it was helping at first.,18,3.5,2,2,evening,restless,conflicted,calm,4,honestly i felt lighter than before i couldnt tell if it was helping at first,3,1,4,False,False,False,True,False,False,False,False,False,False,True,False
737,kind of felt clear enough to plan. then my mind wandered again. after that i could continue.,7,3.5,3,4,morning,restless,vague,focused,3,kind of felt clear enough to plan then my mind wandered again after that i could continue,1,0,4,False,True,False,False,False,True,False,False,False,False,False,False
738,"lowkey felt kind of blank, but this was better than yesterday.",30,7.0,3,5,morning,restless,vague,neutral,1,lowkey felt kind of blank but this was better than yesterday,1,0,4,False,False,False,True,False,False,False,False,False,True,False,False
739,kind of felt itchy in my head. i had to restart once. ...,7,3.5,3,5,morning,calm,clear,restless,4,kind of felt itchy in my head i had to restart once,1,2,0,False,False,True,False,False,False,False,False,False,False,False,True
740,"lowkey felt able to prioritize, but the rain helped a little.",12,4.0,4,2,night,calm,vague,focused,1,lowkey felt able to prioritize but the rain helped a little,4,0,0,False,True,False,False,False,False,True,False,False,False,False,False
741,started off not bad but not clear either. i couldn't tell if it was helping at first. ...,30,5.0,5,1,afternoon,mixed,clear,mixed,3,started off not bad but not clear either i couldnt tell if it was helping at first,2,2,3,False,False,False,True,False,True,False,False,False,False,False,False
742,today i was calmer on the surface but still busy underneath. it took time to click.,10,8.0,3,5,afternoon,mixed,clear,mixed,3,today i was calmer on the surface but still busy underneath it took time to click,2,2,3,False,False,False,False,True,False,True,False,False,False,False,False
743,honestly i felt mentally flooded. it took time to click.,5,7.0,1,2,morning,restless,vague,overwhelmed,5,honestly i felt mentally flooded it took time to click,1,0,4,False,False,True,False,False,False,False,False,False,True,False,False
744,somehow i felt mostly the same. the rain helped a little.,30,8.0,2,3,morning,neutral,vague,neutral,2,somehow i felt mostly the same the rain helped a little,1,0,2,False,False,True,False,False,False,False,True,False,False,False,False
745,kind of felt less tense. i couldn't tell if it was helping at first. not sure why but it shifted.,10,6.0,1,3,night,overwhelmed,vague,calm,2,kind of felt less tense i couldnt tell if it was helping at first not sure why but it shifted,4,0,5,False,False,False,True,False,False,True,False,False,False,False,False
746,"for a while i was more tired than i expected, but then my mind wandered again.",15,8.0,5,3,afternoon,restless,conflicted,overwhelmed,2,for a while i was more tired than i expected but then my mind wandered again,2,1,4,False,False,False,True,False,True,False,False,False,False,False,False
747,felt better,30,4.0,5,4,night,overwhelmed,vague,calm,5,felt better,4,0,5,True,False,False,False,False,False,False,False,True,False,False,False
748,felt better,15,8.5,3,2,night,restless,vague,calm,3,felt better,4,0,4,False,False,False,True,False,False,False,False,True,False,False,False
749,"by the end i was somewhat settled but still uneasy, but mountain visuals made it easier to pause.",15,5.0,1,5,morning,mixed,vague,mixed,3,by the end i was somewhat settled but still uneasy but mountain visuals made it easier to pause,1,0,3,False,True,False,False,False,True,False,False,False,False,False,False
750,mind racing,20,6.0,3,2,afternoon,overwhelmed,clear,neutral,5,mind racing,2,2,5,False,False,False,True,False,False,False,True,False,False,False,False
751,more clear today,12,8.0,3,3,afternoon,overwhelmed,vague,mixed,4,more clear today,2,0,5,False,True,False,False,False,False,False,False,False,False,True,False
752,honestly i felt better but not fully okay. then my mind wandered again.,4,5.0,3,2,afternoon,overwhelmed,conflicted,mixed,5,honestly i felt better but not fully okay then my mind wandered again,2,1,5,False,False,False,False,True,False,False,False,False,False,True,False
753,for a while i was split between calm and tension. i was more tired than i thought. tehn it faded again.,7,7.0,2,5,evening,calm,conflicted,mixed,1,for a while i was split between calm and tension i was more tired than i thought tehn it faded again,3,1,0,True,False,False,False,False,False,False,False,False,False,False,True
754,somehow i felt actually able to focus. sleep probably affected it. ...,35,8.0,5,3,evening,focused,conflicted,focused,1,somehow i felt actually able to focus sleep probably affected it,3,1,1,False,False,False,True,False,False,False,False,False,False,True,False
755,"after the session i felt pretty even, but it took time to click.",25,4.0,2,3,afternoon,overwhelmed,conflicted,neutral,1,after the session i felt pretty even but it took time to click,2,1,5,False,False,True,False,False,True,False,False,False,False,False,False
756,"kind of felt somewhat settled but still uneasy, but i couldn't tell if it was helping at first.",15,3.5,1,3,night,neutral,conflicted,mixed,1,kind of felt somewhat settled but still uneasy but i couldnt tell if it was helping at first,4,1,2,False,False,False,True,False,False,False,True,False,False,False,False
757,"not gonna lie i felt still mentally busy, but mountain visuals made it easier to pause.",5,7.0,3,1,afternoon,overwhelmed,vague,restless,5,not gonna lie i felt still mentally busy but mountain visuals made it easier to pause,2,0,5,True,False,False,False,False,False,False,False,True,False,False,False
758,honestly i felt split between calm and tension. cafe ambience weirdly helped. not sure why but it shifted.,4,5.0,2,3,night,restless,vague,mixed,5,honestly i felt split between calm and tension cafe ambience weirdly helped not sure why but it shifted,4,0,4,False,False,False,False,True,False,False,False,False,True,False,False
759,after the session i felt still carrying too much. the rain helped a little.,10,8.5,4,1,evening,calm,conflicted,overwhelmed,1,after the session i felt still carrying too much the rain helped a little,3,1,0,False,False,True,False,False,False,False,True,False,False,False,False
760,fine i guess,15,7.0,1,5,morning,mixed,vague,focused,1,fine i guess,1,0,3,False,False,True,False,False,False,False,True,False,False,False,False
761,"not gonna lie i felt clear enough to plan, but i stayed with it anyway.",12,7.0,3,3,evening,mixed,clear,focused,2,not gonna lie i felt clear enough to plan but i stayed with it anyway,3,2,3,False,True,False,False,False,False,False,False,False,False,False,True
762,"after the session i felt clear enough to plan, but my breathing slowed for a moment. ...",7,8.0,1,5,morning,neutral,conflicted,focused,4,after the session i felt clear enough to plan but my breathing slowed for a moment,1,1,2,False,True,False,False,False,False,False,True,False,False,False,False
763,after the session i felt not very different. it took time to click. not sure why but it shifted.,30,5.0,2,3,afternoon,focused,conflicted,neutral,4,after the session i felt not very different it took time to click not sure why but it shifted,2,1,1,False,False,False,True,False,False,True,False,False,False,False,False
764,still heavy,12,4.0,5,3,afternoon,neutral,clear,focused,2,still heavy,2,2,2,False,False,True,False,False,False,False,False,False,False,False,True
765,"after the session i felt clearer than earlier, but i kept thinking about emails.",20,8.0,3,5,evening,neutral,clear,focused,3,after the session i felt clearer than earlier but i kept thinking about emails,3,2,2,False,True,False,False,False,False,False,False,True,False,False,False
766,ended up half relaxed half distracted. the rain helped a little.,18,5.0,5,5,morning,neutral,vague,mixed,5,ended up half relaxed half distracted the rain helped a little,1,0,2,False,False,False,True,False,False,False,False,False,True,False,False
767,for a while i was steady but nothing major. the rain helped a little.,18,8.5,3,4,night,neutral,clear,neutral,5,for a while i was steady but nothing major the rain helped a little,4,2,2,False,False,False,True,False,False,False,True,False,False,False,False
768,not much change,18,5.0,5,3,night,overwhelmed,conflicted,restless,1,not much change,4,1,5,False,True,False,False,False,False,False,False,True,False,False,False
769,lowkey felt like everything piled up. i stayed with it anyway.,10,3.5,3,2,night,calm,vague,overwhelmed,3,lowkey felt like everything piled up i stayed with it anyway,4,0,0,False,False,True,False,False,False,True,False,False,False,False,False
770,somehow i felt kind of blank. my breathing slowed for a moment. still not fully there though.,7,4.0,3,2,evening,restless,conflicted,neutral,3,somehow i felt kind of blank my breathing slowed for a moment still not fully there though,3,1,4,False,False,False,True,False,True,False,False,False,False,False,False
771,honestly i felt pretty even. i stayed with it anyway. after that i could continue.,18,7.0,3,4,night,overwhelmed,vague,neutral,2,honestly i felt pretty even i stayed with it anyway after that i could continue,4,0,5,False,True,False,False,False,False,False,False,False,True,False,False
772,started off still mentally busy. forest sounds worked for a bit.,18,8.5,2,5,afternoon,restless,clear,restless,4,started off still mentally busy forest sounds worked for a bit,2,2,4,False,True,False,False,False,False,False,False,False,False,False,True
773,started off surprisingly okay. i was more tired than i thought.,18,3.5,1,3,evening,restless,vague,calm,3,started off surprisingly okay i was more tired than i thought,3,0,4,False,False,False,False,True,False,False,False,False,False,False,True
774,not gonna lie i felt pretty overloaded. cafe ambience weirdly helped. not sure why but it shifted.,4,5.0,5,5,afternoon,calm,conflicted,overwhelmed,2,not gonna lie i felt pretty overloaded cafe ambience weirdly helped not sure why but it shifted,2,1,0,False,False,False,True,False,True,False,False,False,False,False,False
775,not gonna lie i felt itchy in my head. i was more tired than i thought.,25,4.0,4,1,afternoon,restless,vague,restless,4,not gonna lie i felt itchy in my head i was more tired than i thought,2,0,4,False,False,True,False,False,False,True,False,False,False,False,False
776,today i was unable to settle. forest sounds worked for a bit. still not fully there though.,25,7.0,3,1,night,calm,conflicted,restless,1,today i was unable to settle forest sounds worked for a bit still not fully there though,4,1,0,False,True,False,False,False,True,False,False,False,False,False,False
777,not gonna lie i felt restless even after. i was more tired than i thought. still not fully there though.,35,6.0,5,5,afternoon,calm,vague,restless,1,not gonna lie i felt restless even after i was more tired than i thought still not fully there though,2,0,0,False,False,False,True,False,False,False,False,False,False,True,False
778,a little lighter,4,8.5,5,3,morning,calm,clear,overwhelmed,1,a little lighter,1,2,0,False,False,False,True,False,False,False,False,False,True,False,False
779,kind of felt more at ease. the rain helped a little.,25,5.0,1,1,afternoon,calm,vague,calm,4,kind of felt more at ease the rain helped a little,2,0,0,False,False,False,True,False,True,False,False,False,False,False,False
780,somehow i felt heavy in the chest. the rain helped a little.,30,8.5,1,5,night,focused,conflicted,overwhelmed,1,somehow i felt heavy in the chest the rain helped a little,4,1,1,False,False,True,False,False,False,False,True,False,False,False,False
781,"by the end i was still carrying too much, but my breathing slowed for a moment.",12,8.0,5,3,morning,overwhelmed,conflicted,overwhelmed,2,by the end i was still carrying too much but my breathing slowed for a moment,1,1,5,False,False,True,False,False,False,False,False,True,False,False,False
782,kind of felt unable to settle. it took time to click. ...,5,6.0,2,5,night,mixed,clear,restless,2,kind of felt unable to settle it took time to click,4,2,3,False,False,False,False,True,False,False,False,False,False,True,False
783,a little lighter,10,6.0,4,5,evening,focused,vague,neutral,1,a little lighter,3,0,1,False,False,True,False,False,False,False,False,False,True,False,False
784,"honestly i felt able to think straight, but i kept thinking about emails.",20,8.5,2,2,night,restless,clear,focused,1,honestly i felt able to think straight but i kept thinking about emails,4,2,4,True,False,False,False,False,False,False,True,False,False,False,False
785,for a while i was steady but nothing major. sleep probably affected it. still not fully there though.,4,8.5,2,4,afternoon,focused,clear,neutral,5,for a while i was steady but nothing major sleep probably affected it still not fully there though,2,2,1,True,False,False,False,False,False,False,True,False,False,False,False
786,"kind of felt better but not fully okay, but i kept thinking about emails.",18,5.0,5,5,afternoon,mixed,vague,mixed,4,kind of felt better but not fully okay but i kept thinking about emails,2,0,3,False,False,True,False,False,False,False,True,False,False,False,False
787,"ended up mentally flooded, but the rain helped a little.",5,4.0,4,5,evening,mixed,clear,overwhelmed,1,ended up mentally flooded but the rain helped a little,3,2,3,False,False,False,False,True,False,False,False,False,True,False,False
788,bit restless,15,4.0,2,2,evening,restless,clear,restless,1,bit restless,3,2,4,False,False,False,True,False,False,False,False,True,False,False,False
789,lowkey felt itchy in my head. the rain helped a little.,15,6.0,4,5,afternoon,calm,conflicted,restless,4,lowkey felt itchy in my head the rain helped a little,2,1,0,False,True,False,False,False,False,False,False,False,True,False,False
790,"today i was itchy in my head, but i was more tired than i thought. ...",12,8.0,3,3,morning,focused,vague,restless,1,today i was itchy in my head but i was more tired than i thought,1,0,1,True,False,False,False,False,True,False,False,False,False,False,False
791,kind of felt okay overall. my breathing slowed for a moment.,5,8.0,5,5,morning,mixed,conflicted,neutral,5,kind of felt okay overall my breathing slowed for a moment,1,1,3,False,True,False,False,False,False,False,False,True,False,False,False
792,"today i was surprisingly okay, but my breathing slowed for a moment.",30,8.5,1,5,morning,calm,clear,calm,3,today i was surprisingly okay but my breathing slowed for a moment,1,2,0,False,False,True,False,False,False,True,False,False,False,False,False
793,ended up all over the place. mountain visuals made it easier to pause. then it faded again.,5,5.0,1,2,afternoon,neutral,conflicted,restless,4,ended up all over the place mountain visuals made it easier to pause then it faded again,2,1,2,False,True,False,False,False,False,False,False,False,False,False,True
794,honestly i felt split between calm and tension. it took time to click. then it faded again.,25,6.0,4,2,night,calm,clear,mixed,4,honestly i felt split between calm and tension it took time to click then it faded again,4,2,0,False,False,True,False,False,False,False,False,False,False,True,False
795,woke up feeling ready to start work. i was more tired than i thought.,18,6.0,2,2,night,focused,vague,focused,5,woke up feeling ready to start work i was more tired than i thought,4,0,1,False,True,False,False,False,False,False,False,True,False,False,False
796,woke up feeling split between calm and tension. then my mind wandered again.,4,7.0,1,2,morning,mixed,clear,mixed,3,woke up feeling split between calm and tension then my mind wandered again,1,2,3,False,True,False,False,False,False,False,False,True,False,False,False
797,tired but okay,25,8.5,2,2,night,focused,conflicted,calm,4,tired but okay,4,1,1,False,False,True,False,False,False,False,False,False,False,False,True
798,tired but okay,25,6.0,1,4,night,mixed,conflicted,mixed,3,tired but okay,4,1,3,False,False,False,True,False,True,False,False,False,False,False,False
799,kind of felt in between. i was more tired than i thought.,4,4.0,1,3,evening,mixed,conflicted,mixed,4,kind of felt in between i was more tired than i thought,3,1,3,False,False,False,True,False,False,False,True,False,False,False,False
800,not gonna lie i felt unable to come down from the day. sleep probably affected it. not sure why but it shifted.,35,7.0,3,4,afternoon,mixed,clear,overwhelmed,3,not gonna lie i felt unable to come down from the day sleep probably affected it not sure why but it shifted,2,2,3,False,False,True,False,False,False,False,False,True,False,False,False
801,not gonna lie i felt able to prioritize. sleep probably affected it.,20,3.5,2,3,afternoon,focused,conflicted,focused,3,not gonna lie i felt able to prioritize sleep probably affected it,2,1,1,False,True,False,False,False,False,False,False,False,True,False,False
802,"today i was still mentally busy, but i couldn't tell if it was helping at first. ...",12,8.5,3,3,afternoon,focused,clear,restless,3,today i was still mentally busy but i couldnt tell if it was helping at first,2,2,1,True,False,False,False,False,False,False,False,True,False,False,False
803,for a while i was a lot quieter inside. cafe ambience weirdly helped.,15,8.0,2,5,morning,neutral,clear,calm,1,for a while i was a lot quieter inside cafe ambience weirdly helped,1,2,2,False,False,False,True,False,False,False,False,False,False,False,True
804,"woke up feeling less tense, but i was more tired than i thought.",20,3.5,5,1,morning,calm,conflicted,calm,3,woke up feeling less tense but i was more tired than i thought,1,1,0,False,False,False,True,False,True,False,False,False,False,False,False
805,somehow i felt still carrying too much. my breathing slowed for a moment.,18,4.0,1,5,afternoon,mixed,conflicted,overwhelmed,4,somehow i felt still carrying too much my breathing slowed for a moment,2,1,3,False,False,False,False,True,True,False,False,False,False,False,False
806,felt better ...,12,8.5,1,1,evening,restless,clear,overwhelmed,2,felt better,3,2,4,False,True,False,False,False,False,False,True,False,False,False,False
807,still off ...,15,8.0,2,3,evening,restless,clear,calm,3,still off,3,2,4,False,False,True,False,False,False,False,False,False,False,False,True
808,after the session i felt unable to settle. i had to restart once.,15,6.0,3,5,evening,focused,vague,restless,3,after the session i felt unable to settle i had to restart once,3,0,1,False,True,False,False,False,True,False,False,False,False,False,False
809,not gonna lie i felt better but not fully okay. sleep probably affected it. then it faded again. ...,35,6.0,4,2,morning,mixed,clear,mixed,1,not gonna lie i felt better but not fully okay sleep probably affected it then it faded again,1,2,3,False,False,False,True,False,True,False,False,False,False,False,False
810,not much change,12,7.0,5,1,afternoon,calm,vague,focused,3,not much change,2,0,0,True,False,False,False,False,False,False,False,False,False,True,False
811,tired but okay,18,3.5,4,3,evening,focused,clear,focused,4,tired but okay,3,2,1,True,False,False,False,False,False,False,False,True,False,False,False
812,"by the end i was in between, but then my mind wandered again.",25,8.5,5,3,evening,neutral,vague,mixed,2,by the end i was in between but then my mind wandered again,3,0,2,False,False,False,True,False,False,False,False,False,True,False,False
813,kind of felt not bad but not clear either. forest sounds worked for a bit. not sure why but it shifted.,25,8.0,3,1,morning,mixed,vague,mixed,2,kind of felt not bad but not clear either forest sounds worked for a bit not sure why but it shifted,1,0,3,False,False,False,True,False,False,False,False,False,True,False,False
814,"for a while i was more settled, but mountain visuals made it easier to pause.",18,3.5,3,4,night,focused,clear,calm,3,for a while i was more settled but mountain visuals made it easier to pause,4,2,1,False,False,False,False,True,False,False,False,True,False,False,False
815,i noticed i was more organized mentally. it took time to click.,10,7.0,3,2,afternoon,overwhelmed,conflicted,focused,5,i noticed i was more organized mentally it took time to click,2,1,5,False,False,False,False,True,False,False,False,False,False,True,False
816,"lowkey felt less wound up, but forest sounds worked for a bit.",25,4.0,2,3,evening,calm,conflicted,calm,1,lowkey felt less wound up but forest sounds worked for a bit,3,1,0,False,False,False,True,False,False,True,False,False,False,False,False
817,started off pretty even. i kept thinking about emails.,18,8.0,1,3,night,mixed,clear,neutral,3,started off pretty even i kept thinking about emails,4,2,3,False,False,False,True,False,False,False,False,True,False,False,False
818,for a while i was distracted most of the time. my breathing slowed for a moment.,30,5.0,5,5,morning,focused,vague,restless,4,for a while i was distracted most of the time my breathing slowed for a moment,1,0,1,False,False,True,False,False,True,False,False,False,False,False,False
819,started off fine i guess. this was better than yesterday. ...,10,5.0,1,3,afternoon,calm,conflicted,neutral,5,started off fine i guess this was better than yesterday,2,1,0,False,False,True,False,False,False,False,True,False,False,False,False
820,somehow i felt surprisingly okay. i kept thinking about emails.,25,8.5,4,5,evening,neutral,clear,calm,3,somehow i felt surprisingly okay i kept thinking about emails,3,2,2,False,True,False,False,False,True,False,False,False,False,False,False
821,somehow i felt clearer than earlier. then my mind wandered again.,30,8.5,2,2,night,overwhelmed,clear,focused,2,somehow i felt clearer than earlier then my mind wandered again,4,2,5,True,False,False,False,False,False,False,False,False,False,True,False
822,ended up clearer than earlier. i kept thinking about emails. ...,30,8.0,3,1,morning,mixed,vague,focused,4,ended up clearer than earlier i kept thinking about emails,1,0,3,False,False,False,True,False,True,False,False,False,False,False,False
823,"i noticed i was pretty overloaded, but i couldn't tell if it was helping at first.",5,8.5,5,2,night,neutral,conflicted,overwhelmed,1,i noticed i was pretty overloaded but i couldnt tell if it was helping at first,4,1,2,False,False,False,False,True,False,False,False,False,False,False,True
824,today i was like everything piled up. this was better than yesterday.,7,4.0,3,5,night,neutral,vague,overwhelmed,4,today i was like everything piled up this was better than yesterday,4,0,2,False,False,True,False,False,False,False,False,False,False,True,False
825,kinda calm,7,8.0,4,3,evening,overwhelmed,clear,focused,5,kinda calm,3,2,5,False,False,True,False,False,False,False,True,False,False,False,False
